{
  "catalog_version": "dic-fault-catalog-v2",
  "dataset": "NYC TLC Yellow Taxi, modern zone-ID schema, months 2022-01 through 2025-12",
  "case_design": {
    "stages": [
      "ingestion",
      "cleaning",
      "join",
      "aggregation"
    ],
    "severities": [
      "low",
      "medium",
      "high"
    ],
    "seeds": [
      11,
      29,
      47
    ],
    "split_policy": "One mechanism per stage is development and one is held out. Both splits include all four stages and both contract-visible and contract-silent externally detectable cases. Whole mechanisms are split; severity and seed variants never cross splits. The catalog author knows the assignment, which is disclosed as a threat to validity."
  },
  "mechanisms": [
    {
      "fault_id": "ingestion_duplicate_records",
      "stage": "ingestion",
      "locus": "data_fault",
      "detectability_class": "contract_silent_externally_detectable",
      "expected_detection": true,
      "mechanism": "Append exact copies of deterministically selected source rows before ingestion, without changing the input schema.",
      "severity_parameters": {
        "low": {
          "duplicate_rows": 1
        },
        "medium": {
          "duplicate_rows": 10
        },
        "high": {
          "duplicate_rows": 100
        }
      },
      "seeds": [
        11,
        29,
        47
      ],
      "seed_policy": "Seeds 11, 29, and 47 select distinct eligible source-row ordinals after excluding already-selected ordinals; each run reuses its selection deterministically.",
      "original_behavior": "The pipeline ingests the file as supplied; no primary-key constraint identifies exact duplicate trip rows.",
      "affected_scope": "Selected source rows, total ingested rows, and downstream row and fare totals.",
      "oracle": {
        "method": "Compare the injected input against its immutable source using ordered row hashes, then independently count and aggregate with Polars.",
        "independence_basis": "Polars Parquet reader and aggregation expressions are independent of DuckDB execution; source checksum and row ordinals are evaluator-held.",
        "validated_fixture": "Hand-computed three-row fixture with one repeated row: input count 4, distinct source count 3, duplicated row fare contribution counted twice.",
        "established_properties": [
          "exact duplicate row count",
          "ingestion row inflation",
          "fare-sum delta"
        ]
      },
      "detectability": {
        "supported": true,
        "rationale": "No declared uniqueness key makes duplicate trip rows contract-visible, but immutable source comparison identifies the inserted copies independently.",
        "production_evidence": [
          "source checksum",
          "second-engine row and fare reconciliation"
        ]
      },
      "impact": {
        "metric": "Exact excess row count and exact fare-sum delta.",
        "tolerance": "Zero rows; fare sum exact to source decimal precision.",
        "zero_or_null_policy": "Use exact absolute row and currency deltas; do not use relative error when reference fare sum is zero or null."
      },
      "split": "development",
      "eligible_interventions": [
        "replace_input"
      ]
    },
    {
      "fault_id": "ingestion_missing_records",
      "stage": "ingestion",
      "locus": "data_fault",
      "detectability_class": "contract_silent_externally_detectable",
      "expected_detection": true,
      "mechanism": "Remove a deterministic subset of source rows before ingestion while preserving file readability and schema.",
      "severity_parameters": {
        "low": {
          "removed_fraction": 0.001
        },
        "medium": {
          "removed_fraction": 0.01
        },
        "high": {
          "removed_fraction": 0.05
        }
      },
      "seeds": [
        11,
        29,
        47
      ],
      "seed_policy": "Seeds 11, 29, and 47 determine a stable row-ordinal selection; selected counts are rounded up and recorded only in evaluator ground truth.",
      "original_behavior": "The pipeline processes all rows physically present in its input and has no declared expected month row count.",
      "affected_scope": "Selected row ordinals, ingested count, fare sums, and downstream partitions containing removed rows.",
      "oracle": {
        "method": "Compare input row hashes and row counts to the immutable downloaded source; calculate affected sums independently with Polars.",
        "independence_basis": "The downloaded source checksum and Polars recomputation are external to the pipeline detector.",
        "validated_fixture": "Hand-computed five-row fixture with one removed row: exact expected count and group fare sums enumerated in fixture data.",
        "established_properties": [
          "missing row count",
          "missing fare sum",
          "affected keys"
        ]
      },
      "detectability": {
        "supported": true,
        "rationale": "The contract does not declare a fixed monthly count, but source checksums and independent source-to-input reconciliation expose the loss.",
        "production_evidence": [
          "immutable source checksum",
          "second-engine source reconciliation"
        ]
      },
      "impact": {
        "metric": "Exact missing row count and per-key fare-sum deltas.",
        "tolerance": "Zero count error; exact currency sums.",
        "zero_or_null_policy": "Report absolute deltas; relative error is omitted for zero, null, or epsilon-small reference sums."
      },
      "split": "held_out",
      "eligible_interventions": [
        "replace_input"
      ]
    },
    {
      "fault_id": "cleaning_fare_threshold",
      "stage": "cleaning",
      "locus": "code_fault",
      "detectability_class": "contract_visible",
      "expected_detection": true,
      "mechanism": "Replace the declared nonnegative fare filter with a stricter lower threshold for a seeded subset of rows.",
      "severity_parameters": {
        "low": {
          "threshold": 1.0
        },
        "medium": {
          "threshold": 5.0
        },
        "high": {
          "threshold": 20.0
        }
      },
      "seeds": [
        11,
        29,
        47
      ],
      "seed_policy": "Seeds choose disjoint row-ordinal subsets from rows whose fare lies between zero and the threshold; exact selections are evaluator-only.",
      "original_behavior": "The contract retains every parseable row with fare_amount greater than or equal to zero.",
      "affected_scope": "Rows in the selected fare interval and their counts and fare totals by date and pickup zone.",
      "oracle": {
        "method": "Re-evaluate the cleaning predicate row by row from immutable input values using an independently written Polars expression.",
        "independence_basis": "The reference predicate is a separate implementation; fixtures are hand enumerated and no pipeline cleaning function is imported.",
        "validated_fixture": "Six rows with fares -1, 0, 0.5, 4, 10, and null; expected keep/drop masks are hand-written for each threshold.",
        "established_properties": [
          "expected retained row ordinals",
          "row count",
          "fare sum"
        ]
      },
      "detectability": {
        "supported": true,
        "rationale": "Under the frozen M2a contract v2, cleaning is an exact retention predicate: every input row satisfying all declared rules must be retained exactly once. A stricter threshold drops rows that satisfy the declared predicate, violating that v2 invariant. M1 did not implement this row-identity conservation check.",
        "production_evidence": [
          "M2a v2 complete cleaning predicate",
          "source-row identity conservation",
          "independent source-to-clean reconciliation"
        ]
      },
      "impact": {
        "metric": "Exact false-rejection row count and fare-sum delta.",
        "tolerance": "Zero row mismatch; fare sum exact to decimal precision.",
        "zero_or_null_policy": "Report absolute fare delta and exact row count; omit relative error for zero, null, or epsilon-small sums."
      },
      "split": "development",
      "eligible_interventions": [
        "replace_transformation"
      ]
    },
    {
      "fault_id": "cleaning_timestamp_offset",
      "stage": "cleaning",
      "locus": "code_fault",
      "detectability_class": "contract_silent_externally_detectable",
      "expected_detection": true,
      "mechanism": "Apply the severity's deterministic positive timestamp offset to selected pickup timestamps before deriving service dates, while retaining parseable timestamp values.",
      "severity_parameters": {
        "low": {
          "shift_minutes": 15,
          "selected_fraction": 0.01
        },
        "medium": {
          "shift_minutes": 60,
          "selected_fraction": 0.1
        },
        "high": {
          "shift_minutes": 180,
          "selected_fraction": 0.5
        }
      },
      "seeds": [
        11,
        29,
        47
      ],
      "seed_policy": "Seeds 11, 29, and 47 select rows by stable source ordinal; selected timestamps are adjusted by the stated signed offset, fixed positive for this catalog version.",
      "original_behavior": "The pipeline preserves source-local timestamp values and groups using the documented TLC local service date; it does not apply an undocumented UTC conversion.",
      "affected_scope": "Selected pickup timestamps, service-date assignment near day boundaries, and date-zone aggregates.",
      "oracle": {
        "method": "Compare selected source timestamps and date assignments against a separately written Polars expression and hand-calculated local-time fixtures.",
        "independence_basis": "The TLC source data dictionary and hand-computed boundary examples define local timestamp semantics; no DuckDB timestamp function is reused.",